article,topic,cluster
Pengembangan Sistem Informasi Bank Sampah Digital Zerolim Berbasis Aplikasi Perangkat Bergerak Dengan Metode Incremental,"android, aplikasi, pengembangan, berbasis, dan, bergerak, perangkat, menggunakan, studi, kasus",1
Pengembangan Aplikasi Manajemen Tagihan Internet Pelanggan Berbasis Web Untuk Penyedia Internet RT RW: Studi Kasus PT. Bangun Digikomunikasi Indonesia,"android, aplikasi, pengembangan, berbasis, dan, bergerak, perangkat, menggunakan, studi, kasus",1
Implementasi Sistem Penguji Kerentanan Denial of Service (Dos) Pada Web Berbasis WordPress,"android, aplikasi, pengembangan, berbasis, dan, bergerak, perangkat, menggunakan, studi, kasus",1
Pengembangan Aplikasi Edukasi Kesehatan Mental Berbasis Progressive Web App,"android, aplikasi, pengembangan, berbasis, dan, bergerak, perangkat, menggunakan, studi, kasus",1
Pengembangan Sistem Otomatisasi Pemberian Pakan Ikan Nila Berbasis Internet of Things (Studi Kasus: Kampung Sawah Baru),"android, aplikasi, pengembangan, berbasis, dan, bergerak, perangkat, menggunakan, studi, kasus",1
Pengembangan Aplikasi Perangkat Bergerak Sistem Informasi dan Manajemen Bank Sampah Kota Batu berbasis Android (Studi Kasus: Bank Sampah Teratai Putih),"android, aplikasi, pengembangan, berbasis, dan, bergerak, perangkat, menggunakan, studi, kasus",1
Pengembangan Sistem Monitoring pada Identifikasi Kesehatan Pencernaan menggunakan Bluetooth Low Energy (BLE) berbasis Aplikasi Smartphone,"android, aplikasi, pengembangan, berbasis, dan, bergerak, perangkat, menggunakan, studi, kasus",1
Sistem Pemetaan dan Pelaporan Rumah Tidak Layak Huni berbasis Web (Studi Kasus : Dinas Perkim Kabupaten Magetan),"android, aplikasi, pengembangan, berbasis, dan, bergerak, perangkat, menggunakan, studi, kasus",1
Pengembangan Aplikasi Becak Online berbasis Android di Nias Selatan,"android, aplikasi, pengembangan, berbasis, dan, bergerak, perangkat, menggunakan, studi, kasus",1
Pengembangan Sistem Informasi Manajemen Konstruksi pada PT. AA Bersaudara,"android, aplikasi, pengembangan, berbasis, dan, bergerak, perangkat, menggunakan, studi, kasus",1
Pengembangan Aplikasi Perangkat Bergerak Sistem Pemesanan Bahan Pangan berbasis Android (Studi Kasus: PT Uni Farm Indonesia),"android, aplikasi, pengembangan, berbasis, dan, bergerak, perangkat, menggunakan, studi, kasus",1
Penerapan Websocket pada Sistem Live Chat berbasis Web (Studi Kasus Website Kwikku.com),"android, aplikasi, pengembangan, berbasis, dan, bergerak, perangkat, menggunakan, studi, kasus",1
Pengembangan Sistem Informasi Manajemen Klinik berbasis Web (Studi Kasus: Klinik Ortho Dental Malang),"android, aplikasi, pengembangan, berbasis, dan, bergerak, perangkat, menggunakan, studi, kasus",1
Pengembangan Sistem Informasi Manajemen Homestay berbasis Web Studi Kasus Omah Kweni Homestay,"android, aplikasi, pengembangan, berbasis, dan, bergerak, perangkat, menggunakan, studi, kasus",1
Pengembangan Aplikasi Jobs For the Day (JFD) berbasis Android Sebagai Sistem Lowongan Pekerjaan Bagi Pekerja yang Terkena Pemutusan Hubungan Kerja (PHK),"android, aplikasi, pengembangan, berbasis, dan, bergerak, perangkat, menggunakan, studi, kasus",1
Pengembangan Website Pemasaran Jasa Konstruksi menggunakan Pendekatan Goal-Directed Design (GDD). Studi Kasus: CV. Krisna Dwi Karya,"android, aplikasi, pengembangan, berbasis, dan, bergerak, perangkat, menggunakan, studi, kasus",1
Pengembangan E-Modul Berbasis Flipbook pada Materi Aplikasi Penjelajah Internet Mata Pelajaran Informatika Kelas X,"android, aplikasi, pengembangan, berbasis, dan, bergerak, perangkat, menggunakan, studi, kasus",1
"Analisis Performa Networking Library Retrofit, Ktor Client, Okhttp Dan Volley Pada Pengembangan Aplikasi Perangkat Bergerak Berbasis Android","android, aplikasi, pengembangan, berbasis, dan, bergerak, perangkat, menggunakan, studi, kasus",1
Pengembangan Aplikasi Manajemen Pelanggan Divisi Sales Berbasis Mobile dengan Integrasi Layanan Google Maps (Studi Kasus: Dasarata Branch Malang),"android, aplikasi, pengembangan, berbasis, dan, bergerak, perangkat, menggunakan, studi, kasus",1
Analisis Pengaruh Automated Customer Service Berbasis Artificial Intelligence Pada Aplikasi E-commerce (Studi Kasus Aplikasi Lazada),"android, aplikasi, pengembangan, berbasis, dan, bergerak, perangkat, menggunakan, studi, kasus",1
Pengembangan Media Pembelajaran  Berbasis Augmented Reality untuk Pengenalan Topologi Jaringan,"android, aplikasi, pengembangan, berbasis, dan, bergerak, perangkat, menggunakan, studi, kasus",1
Pengembangan Sistem Deteksi Jenis Sel Darah Putih Menggunakan Algoritma Shape Context Berbasis Smartphone,"android, aplikasi, pengembangan, berbasis, dan, bergerak, perangkat, menggunakan, studi, kasus",1
Pembangunan Sistem Informasi Robot BRONE Project Berbasis Web Menggunakan PHP,"android, aplikasi, pengembangan, berbasis, dan, bergerak, perangkat, menggunakan, studi, kasus",1
Evaluasi Usability Sistem Informasi Kearsipan Dinamis Terintegrasi (SRIKANDI) Versi 3: Kasus di Politeknik Kesehatan Kemenkes Malang,"android, aplikasi, pengembangan, berbasis, dan, bergerak, perangkat, menggunakan, studi, kasus",1
Pengembangan Aplikasi pembuatan Kartu Akses untuk Masuk Wilayah PT. Petrokimia Gresik Berbasis Perangkat Bergerak,"android, aplikasi, pengembangan, berbasis, dan, bergerak, perangkat, menggunakan, studi, kasus",1
Pengembangan Sistem Layanan Mandiri Untuk Toko Ritel di Kota Malang Sebagai Solusi Permasalahan Perbelanjaan Berbasis Web (Studi Kasus: PT. Petrolux Arya Mandala),"android, aplikasi, pengembangan, berbasis, dan, bergerak, perangkat, menggunakan, studi, kasus",1
Pengembangan Sistem Smart Farming Berbasis Internet of Things dengan Monitoring Terintegrasi Telegram,"android, aplikasi, pengembangan, berbasis, dan, bergerak, perangkat, menggunakan, studi, kasus",1
"Pengembangan Sistem Informasi Manajemen Jual, Beli, dan Produksi UD Purnama Jaya","android, aplikasi, pengembangan, berbasis, dan, bergerak, perangkat, menggunakan, studi, kasus",1
Pengembangan Sistem Aplikasi Monitoring Sepeda Motor Berbasis IoT dengan Modul GPS Guna Pemantauan dan Keamanan Kendaraan (Studi kasus: Roganda Rental Motorbike),"android, aplikasi, pengembangan, berbasis, dan, bergerak, perangkat, menggunakan, studi, kasus",1
Pengembangan Sistem Informasi Manajemen Berbasis Web Pada  Perusahaan Penempatan Pekerja Migran Indonesia (P3MI) PT. Rastanura  Rayani Saputra,"android, aplikasi, pengembangan, berbasis, dan, bergerak, perangkat, menggunakan, studi, kasus",1
Studi Perbandingan Pengembangan Aplikasi Progressive Web App pada Proses Kompresi Gambar Menggunakan React Image File Resizer dan Native,"android, aplikasi, pengembangan, berbasis, dan, bergerak, perangkat, menggunakan, studi, kasus",1
Pengembangan Aplikasi Mobile Self-care untuk Mahasiswa Berbasis Android dengan Pendekatan Gamifikasi,"android, aplikasi, pengembangan, berbasis, dan, bergerak, perangkat, menggunakan, studi, kasus",1
Pengembangan Aplikasi Mobile Tracker Berat Badan dan Rekomendasi Exercise Planner dengan Metode  Waterfall (Studi Kasus: Fakultas Ilmu Komputer Universitas Brawijaya),"android, aplikasi, pengembangan, berbasis, dan, bergerak, perangkat, menggunakan, studi, kasus",1
Pengembangan Aplikasi Pengelolaan Indekos Berbasis Web (Studi Kasus: Indekos Muslim bunda Rila),"android, aplikasi, pengembangan, berbasis, dan, bergerak, perangkat, menggunakan, studi, kasus",1
Purwarupa Sistem Monitoring Klasifikasi Mutu Air Sumur menggunakan Fuzzy Mamdani (Studi Kasus: Al-Maahira IIBS),"android, aplikasi, pengembangan, berbasis, dan, bergerak, perangkat, menggunakan, studi, kasus",1
Pengembangan Aplikasi Home Nursing menggunakan Geocoding berbasis Mobile dengan Metode Prototyping,"android, aplikasi, pengembangan, berbasis, dan, bergerak, perangkat, menggunakan, studi, kasus",1
Pengembangan Aplikasi Manajemen Pembayaran Biaya Pendidikan Siswa pada SMK Muhammadiyah Cilegon,"android, aplikasi, pengembangan, berbasis, dan, bergerak, perangkat, menggunakan, studi, kasus",1
Pengembangan Sistem Informasi Akademik Multiplatform pada SMA Islam Sabilurrosyad Malang,"android, aplikasi, pengembangan, berbasis, dan, bergerak, perangkat, menggunakan, studi, kasus",1
Pengembangan Aplikasi Web E-Commerce dan Donasi (Studi Kasus : Green Welfare Indonesia),"android, aplikasi, pengembangan, berbasis, dan, bergerak, perangkat, menggunakan, studi, kasus",1
Pengembangan Aplikasi Perangkat Bergerak Panduan Resep Masakan Menggunakan Metode Klasifikasi Gambar Berbasis Android,"android, aplikasi, pengembangan, berbasis, dan, bergerak, perangkat, menggunakan, studi, kasus",1
Pengembangan Single Page Application Berbasis Reactjs Untuk Usaha Percetakan Online (Studi Kasus: Global Grafika),"android, aplikasi, pengembangan, berbasis, dan, bergerak, perangkat, menggunakan, studi, kasus",1
Perancangan dan Implementasi Sistem Informasi Penggajian Karyawan Berbasis Website (Studi Kasus: PT. Bhineka Ciptabahana Pura),"android, aplikasi, pengembangan, berbasis, dan, bergerak, perangkat, menggunakan, studi, kasus",1
Pengembangan Aplikasi Manajemen Inventarisasi dan Keuangan Museum Brawijaya Malang Berbasis Website,"android, aplikasi, pengembangan, berbasis, dan, bergerak, perangkat, menggunakan, studi, kasus",1
Pengembangan E-Modul Mata Pelajaran Informatika Materi Sistem Komputer dan Komponen Penyusunnya dengan Model Pengembangan Borg & Gall (Studi Kasus: SMA),"android, aplikasi, pengembangan, berbasis, dan, bergerak, perangkat, menggunakan, studi, kasus",1
Perancangan Prototype Sistem Informasi Administrasi Sekolah Berbasis Web pada Sekolah Menengah Pertama Negeri 1 Lamasi,"android, aplikasi, pengembangan, berbasis, dan, bergerak, perangkat, menggunakan, studi, kasus",1
Perancangan dan Pembuatan Sistem Pembayaran Berbasis Web Menggunakan Midtrans Sebagai Payment Gateway (Studi Kasus: Kantin Creative Land UB),"android, aplikasi, pengembangan, berbasis, dan, bergerak, perangkat, menggunakan, studi, kasus",1
Pengembangan Gim Edukasi Berbasis Android pada Mata Pelajaran Administrasi Sistem Jaringan di Kelas XI TKJ SMK Negeri 11 Malang,"android, aplikasi, pengembangan, berbasis, dan, bergerak, perangkat, menggunakan, studi, kasus",1
Pengembangan Sistem Informasi Profil dan Layanan Desa Popoh Berbasis Website,"android, aplikasi, pengembangan, berbasis, dan, bergerak, perangkat, menggunakan, studi, kasus",1
Pengembangan Aplikasi Perangkat Bergerak Manajemen Transaksi Bank Sampah RW 05 Dinoyo Berbasis Android (Studi Kasus: Bank Sampah Delima),"android, aplikasi, pengembangan, berbasis, dan, bergerak, perangkat, menggunakan, studi, kasus",1
Rancang Bangun Sistem Penjualan berbasis Web (Studi Kasus CV. Adeeva Group - Jember),"android, aplikasi, pengembangan, berbasis, dan, bergerak, perangkat, menggunakan, studi, kasus",1
Pengembangan Sistem Informasi Barang Hilang Markas Komando Keamanan Universitas Brawijaya berbasis Progressive Web App,"android, aplikasi, pengembangan, berbasis, dan, bergerak, perangkat, menggunakan, studi, kasus",1
"Pengembangan Aplikasi Pencarian dan Penawaran Kerja Paruh Waktu untuk Usaha Mikro, Kecil, dan Menengah (UMKM) berbasis Progressive Web App (Studi Kasus Kota Malang)","android, aplikasi, pengembangan, berbasis, dan, bergerak, perangkat, menggunakan, studi, kasus",1
Pembangunan Sistem Informasi Pemesanan Jasa Foto berbasis Web menggunakan REST API pada Heroe Photography,"android, aplikasi, pengembangan, berbasis, dan, bergerak, perangkat, menggunakan, studi, kasus",1
Pengembangan Sistem Informasi Deteksi Dini Penyakit Tidak Menular (PTM) dengan Pendekatan Rapid Application Development (RAD),"android, aplikasi, pengembangan, berbasis, dan, bergerak, perangkat, menggunakan, studi, kasus",1
Pengembangan Aplikasi berbasis Android Sistem Presensi dengan menggunakan Validasi Koordinat Lokasi dan Foto Selfie di PT. Bintang Mas Glassolutions,"android, aplikasi, pengembangan, berbasis, dan, bergerak, perangkat, menggunakan, studi, kasus",1
Pengembangan Sistem Pelayanan Mobile Perpustakaan Universitas dengan Memanfaatkan Teknologi QR-Code (Studi Kasus: Universitas Islam Raden Rahmat),"android, aplikasi, pengembangan, berbasis, dan, bergerak, perangkat, menggunakan, studi, kasus",1
Pengembangan Sistem Manajemen Sampah TPS3R Dinas Lingkungan Hidup Kota Batu berbasis Web Responsive menggunakan Tailwind dan ReactJS,"android, aplikasi, pengembangan, berbasis, dan, bergerak, perangkat, menggunakan, studi, kasus",1
Prediksi Curah Hujan dengan Empat Parameter menggunakan Backpropagation (Studi Kasus: Stasiun Meteorologi Ahmad Yani),"android, aplikasi, pengembangan, berbasis, dan, bergerak, perangkat, menggunakan, studi, kasus",1
Pengembangan Sistem Informasi Penjualan Moringa berbasis Web (Studi Kasus : PT Tobisa Global Indonesia),"android, aplikasi, pengembangan, berbasis, dan, bergerak, perangkat, menggunakan, studi, kasus",1
Pengembangan IoT Cloud Platform berbasis pada Layanan Serverless Computing,"android, aplikasi, pengembangan, berbasis, dan, bergerak, perangkat, menggunakan, studi, kasus",1
Pembangunan Sistem Informasi Pengelolaan Klinik Mahardika berbasis Web,"android, aplikasi, pengembangan, berbasis, dan, bergerak, perangkat, menggunakan, studi, kasus",1
Pengembangan Aplikasi Toko Buku berbasis Web (Studi Kasus: Toko Buku Online Yukmoco),"android, aplikasi, pengembangan, berbasis, dan, bergerak, perangkat, menggunakan, studi, kasus",1
Pembangunan Sistem Informasi Tugas Akhir berbasis Website Mahasiswa Jurusan Pemanfaatan Sumberdaya Perikanan dan Kelautan (Studi Kasus : Fakultas Perikanan dan Ilmu Kelautan Universitas Brawijaya),"android, aplikasi, pengembangan, berbasis, dan, bergerak, perangkat, menggunakan, studi, kasus",1
Pengembangan Sistem Pemantauan Pelayanan Kesehatan Bagi Penderita Hipertensi berbasis Web (Studi Kasus: Cafe DITA Puskesmas Karangan),"android, aplikasi, pengembangan, berbasis, dan, bergerak, perangkat, menggunakan, studi, kasus",1
Pengembangan Sistem Pengelolaan Toko ATK Pak Eko berbasis Payment Gateway,"android, aplikasi, pengembangan, berbasis, dan, bergerak, perangkat, menggunakan, studi, kasus",1
Pengembangan Sistem Informasi Berbasis Web untuk Mengelola Perpustakaan SMPN 34 Jakarta,"android, aplikasi, pengembangan, berbasis, dan, bergerak, perangkat, menggunakan, studi, kasus",1
Pengembangan Sistem Informasi Akademik Berbasis Web Pada Sekolah Dasar Nahdlatul Ulama’ Kepanjen,"android, aplikasi, pengembangan, berbasis, dan, bergerak, perangkat, menggunakan, studi, kasus",1
Pengembangan Aplikasi Pelatihan Pengucapan Bahasa Inggris di Sekolah Menengah Atas Berbasis Platform iOS Menggunakan SFSpeechRecognizer,"android, aplikasi, pengembangan, berbasis, dan, bergerak, perangkat, menggunakan, studi, kasus",1
Analisis Performa Sistem Berbasis Web dan Desktop dalam Efisiensi Waktu (Studi Kasus : Rez Speed Motoshop),"android, aplikasi, pengembangan, berbasis, dan, bergerak, perangkat, menggunakan, studi, kasus",1
Pengembangan Aplikasi Perangkat Bergerak Pemeriksaan Awal Depresi Dengan Menerapkan Metode Prototyping Berbasis Android,"android, aplikasi, pengembangan, berbasis, dan, bergerak, perangkat, menggunakan, studi, kasus",1
"Pengembangan Aplikasi Perangkat Bergerak Sistem Manajemen Pembelian dan Patungan Hewan Kurban Berbasis Android (Studi Kasus Masjid Al Huda, Malang)","android, aplikasi, pengembangan, berbasis, dan, bergerak, perangkat, menggunakan, studi, kasus",1
Pengembangan Aplikasi Perangkat Bergerak Pembelajaran Bahasa Isyarat Menggunakan Metode Prototyping Berbasis Android (Studi Kasus: Mahasiswa Fakultas Ilmu Komputer Universitas Brawijaya),"android, aplikasi, pengembangan, berbasis, dan, bergerak, perangkat, menggunakan, studi, kasus",1
Pengembangan Aplikasi Monitoring Pelanggaran Siswa pada SMA Negeri 1 Madiun,"android, aplikasi, pengembangan, berbasis, dan, bergerak, perangkat, menggunakan, studi, kasus",1
Pengembangan Aplikasi Sistem Informasi Manajemen Gudang Berbasis Web Menggunakan Metodologi Agile (Studi Kasus: CV. Jaya Laksa Lestari),"android, aplikasi, pengembangan, berbasis, dan, bergerak, perangkat, menggunakan, studi, kasus",1
Pengembangan Aplikasi Pencarian Tempat Penitipan Anak berbasis Android,"android, aplikasi, pengembangan, berbasis, dan, bergerak, perangkat, menggunakan, studi, kasus",1
Pengembangan Aplikasi Perangkat Bergerak Sistem Pendataan Inventaris UKM FILKOM UB,"android, aplikasi, pengembangan, berbasis, dan, bergerak, perangkat, menggunakan, studi, kasus",1
Pengembangan Aplikasi Surat Keluar berbasis Website (Studi Kasus: Human Capital Services PT Bank Syariah Indonesia Tbk),"android, aplikasi, pengembangan, berbasis, dan, bergerak, perangkat, menggunakan, studi, kasus",1
Pengembangan Aplikasi Monitoring Stok Barang berbasis Website (Studi Kasus: PT. Kimia Farma Diagnostika Malang),"android, aplikasi, pengembangan, berbasis, dan, bergerak, perangkat, menggunakan, studi, kasus",1
Pengembangan Sistem Penanganan Administrasi Penerimaan Jasa (Studi Kasus : PT Pupuk Kalimantan Timur),"android, aplikasi, pengembangan, berbasis, dan, bergerak, perangkat, menggunakan, studi, kasus",1
Pembangunan Aplikasi Logistik berbasis Web dengan Integrasi Google Tasks API (Studi Kasus: Toko Alwan),"android, aplikasi, pengembangan, berbasis, dan, bergerak, perangkat, menggunakan, studi, kasus",1
Pengembangan Sistem Monitoring dan Penyiram Tanaman Otomatis berbasis Mobile (Studi Kasus: DD Orchid Nursery),"android, aplikasi, pengembangan, berbasis, dan, bergerak, perangkat, menggunakan, studi, kasus",1
Pembangunan Sistem Informasi Pencarian Kerja berbasis Website,"android, aplikasi, pengembangan, berbasis, dan, bergerak, perangkat, menggunakan, studi, kasus",1
Pembuatan Sistem Informasi Pariwisata Kabupaten Kotawaringin Barat Kalimantan Tengah berbasis Aplikasi Mobile dengan Menggunakan Integrasi REST API,"android, aplikasi, pengembangan, berbasis, dan, bergerak, perangkat, menggunakan, studi, kasus",1
Pengembangan Sistem Informasi Rapor Sekolah Menengah Kejuruan berbasis Kurikulum Merdeka,"android, aplikasi, pengembangan, berbasis, dan, bergerak, perangkat, menggunakan, studi, kasus",1
Pengembangan Aplikasi Web IDE berbasis Mobile sebagai Alat Bantu Proses Pembelajaran Pemrograman Web Kelas X TKJ di SMK Cendika Bangsa,"android, aplikasi, pengembangan, berbasis, dan, bergerak, perangkat, menggunakan, studi, kasus",1
Pengembangan Sistem Aplikasi Pembelajaran Business Process Model and Notation (BPMN),"android, aplikasi, pengembangan, berbasis, dan, bergerak, perangkat, menggunakan, studi, kasus",1
Pengembangan Aplikasi Pengumpulan Laporan Pasien berbasis Android (Studi Kasus Program Pendidikan Dokter Spesialis Neurologi Universitas Brawijaya),"android, aplikasi, pengembangan, berbasis, dan, bergerak, perangkat, menggunakan, studi, kasus",1
Pengembangan Sistem Pendukung Keputusan Perbaikan Kinerja Guru dengan Metode Weighted Product Berbasis Web (Studi Kasus: SMKN 43 Jakarta),"android, aplikasi, pengembangan, berbasis, dan, bergerak, perangkat, menggunakan, studi, kasus",1
Perancangan Interaksi untuk Sistem Manajemen Akun Sistem Informasi di Universitas Brawijaya dengan Kerangka Goal-Directed Design,"android, aplikasi, pengembangan, berbasis, dan, bergerak, perangkat, menggunakan, studi, kasus",1
Pengembangan Sistem Informasi Manajemen Pekerjaan dan Barang Proyek Pemeliharaan Industri Berbasis Web (Studi Kasus: PT. Karunia Utama Maju),"android, aplikasi, pengembangan, berbasis, dan, bergerak, perangkat, menggunakan, studi, kasus",1
Sistem Informasi Perpustakaan Berbasis Web Pada SMK Negeri Wonosari Malang,"android, aplikasi, pengembangan, berbasis, dan, bergerak, perangkat, menggunakan, studi, kasus",1
Pengembangan Sistem Manajemen Data Perencanaan Karir Mahasiswa pada Career Apps Dashboard (Studi Kasus: Direktorat Pengembangan Karier dan Alumni Universitas Brawijaya),"android, aplikasi, pengembangan, berbasis, dan, bergerak, perangkat, menggunakan, studi, kasus",1
Evaluasi Tata Kelola Teknologi Informasi Menggunakan Framework COBIT 5 Pada Domain BAI (Studi Kasus: CV Siap Integrasi),"android, aplikasi, pengembangan, berbasis, dan, bergerak, perangkat, menggunakan, studi, kasus",1
Pengembangan Aplikasi Sistem Informasi Pelayanan Desa berbasis Website (SIMPEDE) pada Desa Dawuhan Kecamatan Poncokusumo Kabupaten Malang,"android, aplikasi, pengembangan, berbasis, dan, bergerak, perangkat, menggunakan, studi, kasus",1
Pengembangan Sistem Informasi Pejabat Pengelola Informasi dan Dokumentasi Kabupaten Solok Selatan berbasis Website,"android, aplikasi, pengembangan, berbasis, dan, bergerak, perangkat, menggunakan, studi, kasus",1
Pengembangan Aplikasi Perangkat Bergerak Panduan dan Resep Masakan untuk Mahasiswa berbasis Android,"android, aplikasi, pengembangan, berbasis, dan, bergerak, perangkat, menggunakan, studi, kasus",1
Pengembangan Sistem berbasis Android Sebagai Pengganti Buku Penghubung untuk Memantau Kecerdasan Anak pada RA Al-Baroroh Menggunakan Metode Prototyping,"android, aplikasi, pengembangan, berbasis, dan, bergerak, perangkat, menggunakan, studi, kasus",1
Pengembangan Media Pembelajaran berbasis WEB pada Mata Pelajaran Komputer dan Jaringan Dasar Kelas X SMK Negeri 5 Malang,"android, aplikasi, pengembangan, berbasis, dan, bergerak, perangkat, menggunakan, studi, kasus",1
Pengembangan Sistem Informasi Penjualan Barang Elektronik berbasis Website menggunakan Framework Laravel (Studi Kasus: UD Berkah Menuju Sukses Jombang),"android, aplikasi, pengembangan, berbasis, dan, bergerak, perangkat, menggunakan, studi, kasus",1
Pengembangan Sistem Point of Sales untuk Toko Emas berbasis Web (Studi Kasus: Toko Mas Leo),"android, aplikasi, pengembangan, berbasis, dan, bergerak, perangkat, menggunakan, studi, kasus",1
Rancang Bangun Sistem Informasi Akademik dan Administrasi Digital berbasis Web di SD Aisyiyah Kota Malang,"android, aplikasi, pengembangan, berbasis, dan, bergerak, perangkat, menggunakan, studi, kasus",1
Pengembangan Sistem Manajemen Pemesanan Barang Interior dan Eksterior Berbasis Web (Studi Kasus CV Omega Art Malang),"android, aplikasi, pengembangan, berbasis, dan, bergerak, perangkat, menggunakan, studi, kasus",1
Pengembangan Sistem Informasi Manajemen Percetakan pada Gajayana Digital Printing Kota Malang berbasis Website,"android, aplikasi, pengembangan, berbasis, dan, bergerak, perangkat, menggunakan, studi, kasus",1
Pengembangan Sistem Informasi Pengiriman Kendaraan Bermotor dan Alat Berat berbasis Web (Studi Kasus: CV. Arsa Jaya Mandiri),"android, aplikasi, pengembangan, berbasis, dan, bergerak, perangkat, menggunakan, studi, kasus",1
Pengembangan Aplikasi untuk Sistem Informasi Manajemen Biro Umroh dan Haji: Kasus Biro Umroh Farfasa Tour Kabupaten Tuban,"android, aplikasi, pengembangan, berbasis, dan, bergerak, perangkat, menggunakan, studi, kasus",1
Pengembangan Sistem Informasi Repositori Internal Fakultas Keguruan dan Ilmu Pendidikan Universitas Safin Pati,"android, aplikasi, pengembangan, berbasis, dan, bergerak, perangkat, menggunakan, studi, kasus",1
Pengembangan Sistem Pengelolaan Barang Toko Kelontong berbasis Website (Studi Kasus: Toko Kelontong Alisa),"android, aplikasi, pengembangan, berbasis, dan, bergerak, perangkat, menggunakan, studi, kasus",1
Pengembangan Sistem Informasi Point of Sale (POS) berbasis Web menggunakan Pendekatan Metode Waterfall (Studi Kasus: Restoran Altari),"android, aplikasi, pengembangan, berbasis, dan, bergerak, perangkat, menggunakan, studi, kasus",1
Studi Implementasi Sistem Informasi berbasis Aplikasi Web terhadap Penurunan Jumlah Error Rate pada Proses Pencatatan Kegiatan Perusahaan Percetakan,"android, aplikasi, pengembangan, berbasis, dan, bergerak, perangkat, menggunakan, studi, kasus",1
Pengembangan Aplikasi Sistem Pelatihan PEKERTI-AA bagi Dosen berbasis Website di Universitas Brawijaya Malang,"android, aplikasi, pengembangan, berbasis, dan, bergerak, perangkat, menggunakan, studi, kasus",1
Pengembangan Lanjut Aplikasi berbasis Android Sistem Presensi Online dengan Penambahan Fitur Notifikasi dan Fitur Permohonan Ijin atau Cuti di PT. Bintang Mas Glassolutions,"android, aplikasi, pengembangan, berbasis, dan, bergerak, perangkat, menggunakan, studi, kasus",1
Pengembangan Aplikasi Pelaporan Nilai Akademik dan Kompetensi Peserta Didik berbasis Website (Studi Kasus: SD Islam Riyadlul Mubtadiin Turen),"android, aplikasi, pengembangan, berbasis, dan, bergerak, perangkat, menggunakan, studi, kasus",1
Pengembangan Aplikasi Perangkat Bergerak Pembelian Bahan Makanan berbasis Android (Studi Kasus: Bahanbaku),"android, aplikasi, pengembangan, berbasis, dan, bergerak, perangkat, menggunakan, studi, kasus",1
Perancangan Proses Bisnis dan Analisis Spesifikasi Persyaratan Sistem Informasi Pemesanan Layanan: Kasus CV Usaha Berkah Abadi,"android, aplikasi, pengembangan, berbasis, dan, bergerak, perangkat, menggunakan, studi, kasus",1
Pengembangan Sistem Informasi Manajemen Akademik Sekolah menggunakan Metode Prototyping (Studi pada Sekolah SMA Negeri Mojoagung),"android, aplikasi, pengembangan, berbasis, dan, bergerak, perangkat, menggunakan, studi, kasus",1
Pembangunan Aplikasi Android Pelacak Truk Tebu untuk Sistem Pos Pantau PG Kebon Agung,"android, aplikasi, pengembangan, berbasis, dan, bergerak, perangkat, menggunakan, studi, kasus",1
Pengembangan Aplikasi E-Portfolio berbasis Website,"android, aplikasi, pengembangan, berbasis, dan, bergerak, perangkat, menggunakan, studi, kasus",1
Pengembangan Sistem Informasi Manajemen Inventaris Sekolah Menengah Kejuruan berbasis Web (Studi pada SMK Negeri 10 Malang),"android, aplikasi, pengembangan, berbasis, dan, bergerak, perangkat, menggunakan, studi, kasus",1
Pengembangan Aplikasi Perangkat Bergerak Pencarian Partner Lomba berbasis Android menggunakan Clean Architecture,"android, aplikasi, pengembangan, berbasis, dan, bergerak, perangkat, menggunakan, studi, kasus",1
Pembangunan Aplikasi Buku Tamu berbasis Web (Studi Kasus pada Sekretariat DPRD Sidoarjo),"android, aplikasi, pengembangan, berbasis, dan, bergerak, perangkat, menggunakan, studi, kasus",1
