article,topic,cluster
Sistem Klasifikasi Air Mineral Layak Minum berdasarkan Nilai PH dan Kekeruhan Menggunakan Metode Naive Bayes berbasis Arduino Uno,"belajar, pembelajaran, mata, pelajaran, siswa, smk, malang, hasil, negeri, terhadap",0
Perbandingan Naive Bayes dan K-Nearest Neighbor untuk Analisis Sentimen Aplikasi Gapura UB Berdasarkan Ulasan Pengguna pada Playstore,"belajar, pembelajaran, mata, pelajaran, siswa, smk, malang, hasil, negeri, terhadap",0
Sistem Deteksi Hipoksia menggunakan Metode Decision Tree berdasarkan Detak Jantung dan Kadar Oksigen,"belajar, pembelajaran, mata, pelajaran, siswa, smk, malang, hasil, negeri, terhadap",0
Pengembangan Gim Edukasi Pembelajaran IQRA-1 dan Tajwid menggunakan Augmented Reality,"belajar, pembelajaran, mata, pelajaran, siswa, smk, malang, hasil, negeri, terhadap",0
Implementasi Aplikasi Perangkat Bergerak Pembelajaran Sistem Organ Peredaran Darah pada Tubuh Manusia berbasis Augmented Reality,"belajar, pembelajaran, mata, pelajaran, siswa, smk, malang, hasil, negeri, terhadap",0
Sistem Monitoring Iklim Mikro pada Prototipe Greenhouse Tanaman Tomat menggunakan Metode Fuzzy dan Aplikasi Telegram,"belajar, pembelajaran, mata, pelajaran, siswa, smk, malang, hasil, negeri, terhadap",0
Sistem Pemanggil Pelayan LCLE (Low Cost Low Energy) berbasis ESP-NOW,"belajar, pembelajaran, mata, pelajaran, siswa, smk, malang, hasil, negeri, terhadap",0
Evaluasi Proses Bisnis Administrasi Pelayanan Akademik Semester Antara pada Fakultas Ilmu Komputer Universitas Brawijaya (FILKOM UB) dengan Metode Quality Evaluation Framework (QEF),"belajar, pembelajaran, mata, pelajaran, siswa, smk, malang, hasil, negeri, terhadap",0
"Ekstraksi Ciri pada Klasifikasi Citra Batik menggunakan Metode Gray Level Co-Occurrence Matrix, Local Binary Pattern, dan HSV Color Moment","belajar, pembelajaran, mata, pelajaran, siswa, smk, malang, hasil, negeri, terhadap",0
Analisis Sentimen terhadap Pemberlakuan Pembatasan Kegiatan Masyarakat (PPKM) Level 3 berdasarkan Data Twitter menggunakan Algoritma Naive Bayes,"belajar, pembelajaran, mata, pelajaran, siswa, smk, malang, hasil, negeri, terhadap",0
Analisis Perbandingan Metode Autentikasi pada Mobile Banking menggunakan Usability Testing dan User Experience Questionnaire (UEQ) (Studi pada BTN Mobile dan Livin' by Mandiri),"belajar, pembelajaran, mata, pelajaran, siswa, smk, malang, hasil, negeri, terhadap",0
Prediksi Penjualan Ponsel Pintar menggunakan Metode Jaringan Syaraf Tiruan Backpropagation Kombinasi Particle Swarm Optimization,"belajar, pembelajaran, mata, pelajaran, siswa, smk, malang, hasil, negeri, terhadap",0
Implementasi Filtrasi Sinyal Electrocardiogram (ECG) menggunakan metode Butterworth pada Android dengan Teknologi Edge Computing,"belajar, pembelajaran, mata, pelajaran, siswa, smk, malang, hasil, negeri, terhadap",0
Analisis Sentimen Ulasan Pelanggan dengan Metode Support Vector Machine (SVM) untuk Peningkatan Kualitas Layanan pada Restoran Warung Wareg,"belajar, pembelajaran, mata, pelajaran, siswa, smk, malang, hasil, negeri, terhadap",0
Evaluasi Proses Bisnis Administrasi Akademik pada Institusi ABC dengan menggunakan Quality Evaluation Framework (QEF),"belajar, pembelajaran, mata, pelajaran, siswa, smk, malang, hasil, negeri, terhadap",0
Sistem Klasifikasi Kualitas Daging Ayam Broiler sebagai Bahan Pembuatan Bakso berdasar Nilai Resistansi dan Kadar Amonia dengan menggunakan Metode Fuzzy,"belajar, pembelajaran, mata, pelajaran, siswa, smk, malang, hasil, negeri, terhadap",0
Efektivitas Undian Turnamen Model Single Elimination Pada Platform Event Bracket Dibandingkan Dengan Aplikasi Php Laravel Menggunakan Algoritma Fisher-Yates Shuffle,"belajar, pembelajaran, mata, pelajaran, siswa, smk, malang, hasil, negeri, terhadap",0
Pembangunan Dashboard Business Intelligence Visualisasi Data Akademik Pada MTSN 3 Malang,"belajar, pembelajaran, mata, pelajaran, siswa, smk, malang, hasil, negeri, terhadap",0
Klasifikasi Kerusakan Permukaan Jalan Menggunakan Model MobileNetV3-Small,"belajar, pembelajaran, mata, pelajaran, siswa, smk, malang, hasil, negeri, terhadap",0
Analisis Faktor yang Memengaruhi Perilaku Penggunaan Aplikasi GoPay: Transfer & Payment Mempergunakan Model Unified Theory Of Acceptance And Use Of Technology (UTAUT),"belajar, pembelajaran, mata, pelajaran, siswa, smk, malang, hasil, negeri, terhadap",0
Analisis Faktor-Faktor yang Memengaruhi Search Engine Result Page (SERP) Menggunakan Metode SEO On-Page dan Off-Page (Studi Kasus: Situs Ulasan CBD Oil Australia),"belajar, pembelajaran, mata, pelajaran, siswa, smk, malang, hasil, negeri, terhadap",0
Alat Ukur Berat dan Volume Buah Menggunakan Multi Sensor Ultrasonik dan Metode Regresi Linier Berganda Berbasis Arduino Uno,"belajar, pembelajaran, mata, pelajaran, siswa, smk, malang, hasil, negeri, terhadap",0
Penerapan Progressive Disclosure dan Hierarki pada Aplikasi M.Tix untuk Meningkatkan Usability,"belajar, pembelajaran, mata, pelajaran, siswa, smk, malang, hasil, negeri, terhadap",0
Hubungan Jenjang Pendidikan Terakhir Dan Kemampuan Manajemen Waktu Terhadap Hasil Belajar Pemrograman Komputer Tingkat Dasar Pada Mahasiswa Di Fakultas Ilmu Komputer Universitas Brawijaya,"belajar, pembelajaran, mata, pelajaran, siswa, smk, malang, hasil, negeri, terhadap",0
Analisis Kualitas Website Brone Menggunakan Webqual 4.0 dan Importance-Performance Analysis (IPA) (Studi Kasus: Mahasiswa Fakultas Ilmu Komputer Universitas Brawijaya),"belajar, pembelajaran, mata, pelajaran, siswa, smk, malang, hasil, negeri, terhadap",0
Analisis Performa Model Convolutional Neural Network Dalam Mendeteksi Penyakit Pneumonia,"belajar, pembelajaran, mata, pelajaran, siswa, smk, malang, hasil, negeri, terhadap",0
"Rancang Bangun Sistem Deteksi Asma, Bronkitis, dan Pneumonia Melalui Suara Pernapasan dengan Metode Long Short-Term Memory","belajar, pembelajaran, mata, pelajaran, siswa, smk, malang, hasil, negeri, terhadap",0
Pengembangan Media Pembelajaran Berbasis Augmented Reality untuk Pengenalan Gerbang Logika Dasar bagi Siswa dengan Gaya Belajar Auditori,"belajar, pembelajaran, mata, pelajaran, siswa, smk, malang, hasil, negeri, terhadap",0
Penerapan Transformasi Fractional Pada Representasi Fitur Mel Frequency Cepstral  Coefficients (MFCC) untuk Mendeteksi Tingkat Emosi Disgust,"belajar, pembelajaran, mata, pelajaran, siswa, smk, malang, hasil, negeri, terhadap",0
Sistem Pendeteksi Kekerasan di Ruang Publik Menggunakan Metode 3D Convolutional Neural Network,"belajar, pembelajaran, mata, pelajaran, siswa, smk, malang, hasil, negeri, terhadap",0
"Analisis Pengaruh Kualitas Kegunaan, Kualitas Informasi, dan Kualitas Interaksi Layanan terhadap Kepuasan Pengguna pada Website MAGENTA menggunakan Metode Webqual 4.0","belajar, pembelajaran, mata, pelajaran, siswa, smk, malang, hasil, negeri, terhadap",0
Klasifikasi Ekspresi Wajah Manusia Menggunakan Metode CNN Dengan Arsitektur Visual Geometry Group (VGG-Net),"belajar, pembelajaran, mata, pelajaran, siswa, smk, malang, hasil, negeri, terhadap",0
Peramalan Aliran Uang Masuk dan Keluar (Inflow dan Outflow) Regional Bank Indonesia di Provinsi DKI Jakarta Menggunakan Metode FBProphet,"belajar, pembelajaran, mata, pelajaran, siswa, smk, malang, hasil, negeri, terhadap",0
Evaluasi dan Perbaikan Pengalaman Pengguna Website Pemerintah Kab. Sidenreng Rappang dengan Metode Evaluasi Heuristic,"belajar, pembelajaran, mata, pelajaran, siswa, smk, malang, hasil, negeri, terhadap",0
Sistem Klasifikasi Kualitas Daging Sapi Berdasarkan Warna dan Gas Amonia Menggunakan Jaringan Saraf Tiruan,"belajar, pembelajaran, mata, pelajaran, siswa, smk, malang, hasil, negeri, terhadap",0
Klasifikasi Kinerja Akademik Mahasiswa Menggunakan  Algoritma Modified K-Nearest Neighbor  (Studi Pada S1 Pendidikan Teknologi Informasi Fakultas Ilmu Komputer),"belajar, pembelajaran, mata, pelajaran, siswa, smk, malang, hasil, negeri, terhadap",0
Analisis Faktor-Faktor Yang Memengaruhi Keputusan Siswa Jurusan TKJ SMKN 2 Malang dalam Melanjutkan Pendidikan Atau Kerja Industri,"belajar, pembelajaran, mata, pelajaran, siswa, smk, malang, hasil, negeri, terhadap",0
Analisis Faktor yang Mempengaruhi Tingkat Penerimaan Teknologi pada Pengguna Aplikasi Notion Menggunakan Technology Acceptance Model (TAM) Termodifikasi,"belajar, pembelajaran, mata, pelajaran, siswa, smk, malang, hasil, negeri, terhadap",0
Sistem Monitoring Lingkungan Untuk Budidaya Tanaman Sawi (Brassica Juncea L.) Menggunakan Fuzzy Dan Android,"belajar, pembelajaran, mata, pelajaran, siswa, smk, malang, hasil, negeri, terhadap",0
Pengembagnan Aplikasi SIDAKU Mobile di Plut-KUMKM Kota Batu,"belajar, pembelajaran, mata, pelajaran, siswa, smk, malang, hasil, negeri, terhadap",0
Segmentasi Pelanggan B2B dengan Model LRFM Menggunakan Algoritma K-Means,"belajar, pembelajaran, mata, pelajaran, siswa, smk, malang, hasil, negeri, terhadap",0
Analisis Sentimen Root Cause Analisis Kepuasan Pengguna Aplikasi Tokopedia Pada Ulasan Menggunakan Metode Random Forest,"belajar, pembelajaran, mata, pelajaran, siswa, smk, malang, hasil, negeri, terhadap",0
Analisis Pengaruh Kualitas Layanan Terhadap Tingkat Kepuasan dan Loyalitas Pengguna Aplikasi Access by KAI Menggunakan Model  E-SERVQUAL Termodifikasi,"belajar, pembelajaran, mata, pelajaran, siswa, smk, malang, hasil, negeri, terhadap",0
Analisis Perturbasi Glaze dan Nightshade dalam Perlindungan Karya Seni Digital Menggunakan Image Quality Assessment,"belajar, pembelajaran, mata, pelajaran, siswa, smk, malang, hasil, negeri, terhadap",0
Sistem Deteksi Penyakit Pernafasan Berdasarkan Suara Pernafasan Menggunakan Analisis Spektral Berbasis Raspberry Pi 4Sistem Deteksi Penyakit Pernafasan Berdasarkan Suara Pernafasan Menggunakan Analisis Spektral Berbasis Raspberry Pi 4,"belajar, pembelajaran, mata, pelajaran, siswa, smk, malang, hasil, negeri, terhadap",0
Penerapan Model Whisper Pada Embedded System untuk Speech To Text,"belajar, pembelajaran, mata, pelajaran, siswa, smk, malang, hasil, negeri, terhadap",0
Deteksi Mutasi Kanker Paru Pada Citra CT-Scan Menggunakan ResNet-CNN,"belajar, pembelajaran, mata, pelajaran, siswa, smk, malang, hasil, negeri, terhadap",0
Modifikasi Algoritma Dijkstra untuk Penentuan Multi-Path dalam Topologi Jaringan Sensor Nirkabel,"belajar, pembelajaran, mata, pelajaran, siswa, smk, malang, hasil, negeri, terhadap",0
Analisis Perbandingan Titik Optimal Sensor MPU6050 Pada Latihan Angkat Beban Untuk Otot Biceps Dengan Metode F-Test Dan Ratio Games,"belajar, pembelajaran, mata, pelajaran, siswa, smk, malang, hasil, negeri, terhadap",0
Implementasi Model Flipped classroom Terhadap Hasil Belajar Peserta Didik Kelas X Program Keahlian Rekayasa Perangkat Lunak Pada Mata Pelajaran Informatika di SMK Negeri 8 Malang,"belajar, pembelajaran, mata, pelajaran, siswa, smk, malang, hasil, negeri, terhadap",0
Pengaruh Implementasi Flowgorithm Terhadap Hasil Belajar Peserta Didik SMA Negeri 3 Malang Pada Mata Pelajaran Informatika Menggunakan Model Pembelajaran Problem Based Learning,"belajar, pembelajaran, mata, pelajaran, siswa, smk, malang, hasil, negeri, terhadap",0
Analisis Penerapan Algoritma Decision Tree dalam Watch-List Filtering Remitansi Lembaga Keuangan,"belajar, pembelajaran, mata, pelajaran, siswa, smk, malang, hasil, negeri, terhadap",0
Topic Modelling Pada Aktivitas Pengembangan Perangkat Lunak Menggunakan BERTopic,"belajar, pembelajaran, mata, pelajaran, siswa, smk, malang, hasil, negeri, terhadap",0
Pengembangan Wearable Device Untuk Deteksi  Postur Duduk Manusia Berbasis Data Sensor MPU6050  Menggunakan Metode Support Vector Machine,"belajar, pembelajaran, mata, pelajaran, siswa, smk, malang, hasil, negeri, terhadap",0
Pengaruh Penggunaan Media Pembelajaran Interaktif dalam Pembelajaran Problem Based Learning pada Mata Pelajaran Informatika Terhadap Hasil Belajar Siswa Kelas X di SMKN 3 Malang,"belajar, pembelajaran, mata, pelajaran, siswa, smk, malang, hasil, negeri, terhadap",0
Hubungan Student Engagement Dengan Prestasi Hasil Belajar Siswa Dalam Konteks Problem Based Learning Jurusan Teknik Komputer Dan Jaringan di SMKN 2 Malang,"belajar, pembelajaran, mata, pelajaran, siswa, smk, malang, hasil, negeri, terhadap",0
Pengaruh Serangan Wormhole terhadap Kinerja Protokol Temporally Ordered Routing Algorithm (TORA) pada Mobile Ad Hoc Network (MANET),"belajar, pembelajaran, mata, pelajaran, siswa, smk, malang, hasil, negeri, terhadap",0
Implementasi WebRTC pada Sistem Multimedia Teleconference untuk Komunikasi Pembelajaran Tunarungu,"belajar, pembelajaran, mata, pelajaran, siswa, smk, malang, hasil, negeri, terhadap",0
Analisis Sentimen Ulasan Pelanggan Kober Mie Setan menggunakan Algoritma Support Vector Machine,"belajar, pembelajaran, mata, pelajaran, siswa, smk, malang, hasil, negeri, terhadap",0
Sistem Deteksi Daun Busuk pada Pakcoy Hidroponik menggunakan Metode Thresholding pada Warna Hue dan Saturasi berbasis Raspberry Pi,"belajar, pembelajaran, mata, pelajaran, siswa, smk, malang, hasil, negeri, terhadap",0
Analisis Sentimen Ulasan Google Review New Star Cineplex Pasuruan menggunakan Artificial Neural Network (ANN),"belajar, pembelajaran, mata, pelajaran, siswa, smk, malang, hasil, negeri, terhadap",0
Klasifikasi Rumah Sehat dengan Metode Jaringan Syaraf Tiruan berbasis ESP32-S,"belajar, pembelajaran, mata, pelajaran, siswa, smk, malang, hasil, negeri, terhadap",0
Sistem Pendeteksi Premature Ventricular Contraction (PVC) berdasarkan Lebar QRS dan Gradien R menggunakan Metode FK-NN,"belajar, pembelajaran, mata, pelajaran, siswa, smk, malang, hasil, negeri, terhadap",0
Sistem Deteksi Permukaan Jalan pada Kursi Roda Pintar dengan Metode MobileNetV2,"belajar, pembelajaran, mata, pelajaran, siswa, smk, malang, hasil, negeri, terhadap",0
"Sistem Deteksi Kematangan Cabai Hidroponik menggunakan Metode Thresholding pada Warna Hue, Saturation, dan Value","belajar, pembelajaran, mata, pelajaran, siswa, smk, malang, hasil, negeri, terhadap",0
Analisis Peran Tingkat Pendidikan dan Platform Komunikasi dalam Menunjang Produktivitas Kerja Karyawan Work From Anywhere (WFA),"belajar, pembelajaran, mata, pelajaran, siswa, smk, malang, hasil, negeri, terhadap",0
"Evaluasi dan Perbaikan Rancangan Antarmuka Pengguna Web Dinas Kebudayaan, Pariwisata, Pemuda dan Olahraga Kota Kediri menggunakan Metode Goal-Directed Design (GDD)","belajar, pembelajaran, mata, pelajaran, siswa, smk, malang, hasil, negeri, terhadap",0
Deteksi Plat Nama Ruangan untuk Kendali Kursi Roda Pintar menggunakan YOLOv5 dan EasyOCR berbasis TX2,"belajar, pembelajaran, mata, pelajaran, siswa, smk, malang, hasil, negeri, terhadap",0
Pengembangan Customer Relationship Management (CRM) Sistem Umpan Balik Pelanggan (Customer Feedback System) pada Perusahaan XYZ,"belajar, pembelajaran, mata, pelajaran, siswa, smk, malang, hasil, negeri, terhadap",0
Simulasi Protokol Routing AODV untuk Skenario Mobilitas Node,"belajar, pembelajaran, mata, pelajaran, siswa, smk, malang, hasil, negeri, terhadap",0
Sistem Pengenalan Plat Nomor Kendaraan untuk Akses Perumahan menggunakan YOLOv5 dan Pytesseract berbasis Jetson Nano,"belajar, pembelajaran, mata, pelajaran, siswa, smk, malang, hasil, negeri, terhadap",0
Evaluasi Kualitas Website IKIP Budi Utomo Malang menggunakan Metode Webqual 4.0 dan Importance Performance Analysis (IPA),"belajar, pembelajaran, mata, pelajaran, siswa, smk, malang, hasil, negeri, terhadap",0
Rekomendasi Peningkatan Layanan Okejek dengan Root Cause Analysis berdasarkan Hasil Analisis Sentimen Ulasan Pengguna,"belajar, pembelajaran, mata, pelajaran, siswa, smk, malang, hasil, negeri, terhadap",0
Analisis Sentimen Tokocrypto pada Twitter menggunakan Metode Long Short-Term Memory,"belajar, pembelajaran, mata, pelajaran, siswa, smk, malang, hasil, negeri, terhadap",0
Analisis Sentimen Pengguna Aplikasi RedBus berdasarkan Ulasan di Google Play Store menggunakan Metode Naive Bayes,"belajar, pembelajaran, mata, pelajaran, siswa, smk, malang, hasil, negeri, terhadap",0
Analisis dan Penyusunan Spesifikasi Persyaratan Pengguna dan Sistem Aplikasi BudayaKerja dengan Pendekatan Rekayasa Balik: Kasus Perusahaan SmartID,"belajar, pembelajaran, mata, pelajaran, siswa, smk, malang, hasil, negeri, terhadap",0
Analisis Usability dan Pengalaman Pengguna Website SMAN 5 Bogor versi Mobile menggunakan MeCUE Questionnaire dan System Usability Scale (SUS),"belajar, pembelajaran, mata, pelajaran, siswa, smk, malang, hasil, negeri, terhadap",0
Implementasi Robot Manipulator menggunakan Sinyal Electromyography berdasarkan Pergerakan Kaki Manusia,"belajar, pembelajaran, mata, pelajaran, siswa, smk, malang, hasil, negeri, terhadap",0
Pengembangan Konten Pembelajaran Audio Visual untuk Materi Jaringan Nirkabel melalui Fitur Reels Instagram pada Jurusan Teknik Komputer Jaringan SMK Negeri 4 Malang,"belajar, pembelajaran, mata, pelajaran, siswa, smk, malang, hasil, negeri, terhadap",0
Pengaruh Motivasi Belajar terhadap Performa Mahasiswa Pasca Pandemi COVID-19,"belajar, pembelajaran, mata, pelajaran, siswa, smk, malang, hasil, negeri, terhadap",0
Pemodelan dan Evaluasi Proses Bisnis menggunakan Business Process Improvement (BPI) (Studi Kasus : Bagian Humas Universitas Mataram),"belajar, pembelajaran, mata, pelajaran, siswa, smk, malang, hasil, negeri, terhadap",0
Sistem Diagnosis Kerusakan pada Iphone dengan Metode Dempster Shafer,"belajar, pembelajaran, mata, pelajaran, siswa, smk, malang, hasil, negeri, terhadap",0
Eksplorasi Perilaku Mahasiswa dalam Implementasi Pembelajaran Hybrid di IT Telkom Surabaya,"belajar, pembelajaran, mata, pelajaran, siswa, smk, malang, hasil, negeri, terhadap",0
Sistem Deteksi Insomnia berbasis Elektrokardiogram menggunakan Fitur Mean RR dan Standar Deviasi NN dengan Metode K-Nearest Neighbours,"belajar, pembelajaran, mata, pelajaran, siswa, smk, malang, hasil, negeri, terhadap",0
Analisis Faktor-Faktor yang Mempengaruhi Prestasi Belajar Siswa Kelas 11 Rekayasa Perangkat Lunak pada Mata Pelajaran Basis Data di SMK National Media Center Malang,"belajar, pembelajaran, mata, pelajaran, siswa, smk, malang, hasil, negeri, terhadap",0
Perancangan Modul Tambahan Portal Media Interaksi Sivitas Universitas Brawijaya bagi Alumni Universitas Brawijaya menggunakan Design Thinking,"belajar, pembelajaran, mata, pelajaran, siswa, smk, malang, hasil, negeri, terhadap",0
Analisis Sentimen terhadap Perundungan Siber pada Twitter menggunakan Algoritma Bidirectional Encoder Representations from Transformer (BERT),"belajar, pembelajaran, mata, pelajaran, siswa, smk, malang, hasil, negeri, terhadap",0
Sistem Pendeteksi Kantuk Pengemudi berbasis Eye Aspect Ratio dan Mouth Opening Ratio menggunakan Algoritme C-LSTM,"belajar, pembelajaran, mata, pelajaran, siswa, smk, malang, hasil, negeri, terhadap",0
Analisis Pengalaman Pengguna pada Website Kampus Merdeka menggunakan Metode UX Curve,"belajar, pembelajaran, mata, pelajaran, siswa, smk, malang, hasil, negeri, terhadap",0
Analisis Protokol Routing Reactive pada Jaringan Vehicular Ad Hoc Network (VANET) dengan Model Skenario Jalan Tol,"belajar, pembelajaran, mata, pelajaran, siswa, smk, malang, hasil, negeri, terhadap",0
Pengembangan Gateway untuk Mendukung Proses Over The Air Firmware Update pada Perangkat WSN berbasis Bluetooth Low Energy,"belajar, pembelajaran, mata, pelajaran, siswa, smk, malang, hasil, negeri, terhadap",0
Sistem Kontrol dan Monitoring Prototype Smart Green House pada Tanaman Stroberi menggunakan Logika Fuzzy berbasis Aplikasi Cayenne,"belajar, pembelajaran, mata, pelajaran, siswa, smk, malang, hasil, negeri, terhadap",0
Sistem Pengenalan Tingkatan Emosi Ketakutan Melalui Ucapan menggunakan Ekstraksi Gammatone-Frequency Cepstral Coefficients dan Klasifikasi Random Forest Classifier berbasis Raspberry Pi 4,"belajar, pembelajaran, mata, pelajaran, siswa, smk, malang, hasil, negeri, terhadap",0
Rekomendasi Penempatan Kegiatan Praktek Kerja Lapangan (PKL) menggunakan Metode Profile Matching pada Jurusan Teknik Komputer dan Jaringan (TKJ) di SMK Negeri 2 Malang,"belajar, pembelajaran, mata, pelajaran, siswa, smk, malang, hasil, negeri, terhadap",0
Penyusunan Spesifikasi Persyaratan dan Pemodelan Proses Bisnis  Terhadap Aplikasi Skrining Covid-19: Kasus Areema di Kabupaten  Malang,"belajar, pembelajaran, mata, pelajaran, siswa, smk, malang, hasil, negeri, terhadap",0
Analisis Faktor-faktor yang Memengaruhi Minat Penggunaan Ulang Mahasiswa pada Platform E-Learning dan Bootcamp IT,"belajar, pembelajaran, mata, pelajaran, siswa, smk, malang, hasil, negeri, terhadap",0
"Pengaruh Minat Belajar, Motivasi Belajar, dan Gaya Belajar Siswa Terhadap Hasil Belajar Siswa Kelas XI Pada Mata Pelajaran Pemrograman Website Di SMKN 11 Malang","belajar, pembelajaran, mata, pelajaran, siswa, smk, malang, hasil, negeri, terhadap",0
Persepsi Peserta Didik pada Penggunaan Aplikasi Canon Berbasis Web dalam Pembelajaran Materi Triangle Exposure,"belajar, pembelajaran, mata, pelajaran, siswa, smk, malang, hasil, negeri, terhadap",0
Implementasi Metode K-Nearest Neighbor untuk Deteksi Dini Stres Berbasis Neruosky Electroencephalogram Sensor,"belajar, pembelajaran, mata, pelajaran, siswa, smk, malang, hasil, negeri, terhadap",0
Identifikasi Permasalahan Pembelajaran Terkait Aksesibilitas Learning Management System BRONE (Brawijaya Online Learning) Berdasarkan WCAG (Web Content Accessibility Guidelines) pada Mahasiswa Disabilitas Netra,"belajar, pembelajaran, mata, pelajaran, siswa, smk, malang, hasil, negeri, terhadap",0
Analisis Penjualan Bobby Aquatic Menggunakan K-Means Clustering dan Holt-Winters dengan Pendekatan CRISP-DM,"belajar, pembelajaran, mata, pelajaran, siswa, smk, malang, hasil, negeri, terhadap",0
Persepsi Peserta Didik pada Penggunaan PC Building Simulator Sebagai Media Pembelajaran dalam Proses Pembelajaran Materi Perakitan Komputer,"belajar, pembelajaran, mata, pelajaran, siswa, smk, malang, hasil, negeri, terhadap",0
Pengenalan Plat Nomor Kendaraan Indonesia Menggunakan Convolutional Neural Network dan BiLSTM,"belajar, pembelajaran, mata, pelajaran, siswa, smk, malang, hasil, negeri, terhadap",0
Implementasi Sistem Informasi Penerimaan Siswa Baru Sekolah Khusus Yayasan Karya Dharma Wanita Khusus Tuli (SKH YKDW 02) Kota Tangerang,"belajar, pembelajaran, mata, pelajaran, siswa, smk, malang, hasil, negeri, terhadap",0
Deteksi Tingkat Resiko Kanker Serviks pada Wanita Usia Subur dengan  Metode Modified K-Nearest Neighbor,"belajar, pembelajaran, mata, pelajaran, siswa, smk, malang, hasil, negeri, terhadap",0
Analisis Kepuasan Pengguna IM3 Terhadap Aplikasi MyIM3 Menggunakan Metode End User Computing Satisfaction (EUCS) Termodifikasi,"belajar, pembelajaran, mata, pelajaran, siswa, smk, malang, hasil, negeri, terhadap",0
Analisis Faktor yang Memengaruhi Penggunaan Cryptocurrency Menggunakan Unified Theory of Acceptance and use of Technology (UTAUT) Termodifikasi (Studi Kasus Pada Generasi Z di DKI Jakarta),"belajar, pembelajaran, mata, pelajaran, siswa, smk, malang, hasil, negeri, terhadap",0
Analisis Perbandingan Waktu Simpan ke Database Antara Gambar BLOB dan Konversi Base64 pada Website Sosial Media,"belajar, pembelajaran, mata, pelajaran, siswa, smk, malang, hasil, negeri, terhadap",0
Pengaruh Metode Problem-based Learning Berbantuan Github dan ChatGPT terhadap Hasil Belajar dan Computational Thinking Skill Siswa,"belajar, pembelajaran, mata, pelajaran, siswa, smk, malang, hasil, negeri, terhadap",0
Prediksi Penjualan Makanan Restororan Menggunakan Metode ARIMA: Studi Kasus Waroeng Marisukakoi,"belajar, pembelajaran, mata, pelajaran, siswa, smk, malang, hasil, negeri, terhadap",0
Evaluasi Proses Bisnis Penjualan Produk Pusat Penelitian Perkebunan Gula Indonesia Menggunakan Business Process Improvement (BPI),"belajar, pembelajaran, mata, pelajaran, siswa, smk, malang, hasil, negeri, terhadap",0
Strategi Peningkatan SDM Berdasarkan Pengelompokan Kualitas Kinerja Pegawai CV Mediatama Perkasa Bogor Menggunakan K-Means Clustering,"belajar, pembelajaran, mata, pelajaran, siswa, smk, malang, hasil, negeri, terhadap",0
Perbandingan Implementasi Material Design 2 dan 3 pada Aplikasi Perangkat Bergerak untuk Pemesanan Jasa Binatu,"belajar, pembelajaran, mata, pelajaran, siswa, smk, malang, hasil, negeri, terhadap",0
Pengembangan Aplikasi Deteksi Allergen pada Makanan Menggunakan Convolutional Neural Network Berbasis Android,"belajar, pembelajaran, mata, pelajaran, siswa, smk, malang, hasil, negeri, terhadap",0
Sistem Pelatihan Pengucapan Huruf Konsonan Untuk Anak Usia Dini Menggunakan Metode Random Forest,"belajar, pembelajaran, mata, pelajaran, siswa, smk, malang, hasil, negeri, terhadap",0
Penerapan Metode Moving Average dan Exponential Smoothing pada Peramalan Indeks Pembangunan Manusia di Provinsi Papua Pegunungan,"belajar, pembelajaran, mata, pelajaran, siswa, smk, malang, hasil, negeri, terhadap",0
Pengaruh Implementasi Penggunaan Media Pembelajaran Gitpod pada Model Problem Based Learning dalam Mata Pelajaran Informatika Terhadap Hasil Belajar Siswa SMAN 3 Malang,"belajar, pembelajaran, mata, pelajaran, siswa, smk, malang, hasil, negeri, terhadap",0
Sistem Pengatur Kecepatan Motor Robot Beroda untuk Mengurangi Selip Menggunakan Metode Fuzzy,"belajar, pembelajaran, mata, pelajaran, siswa, smk, malang, hasil, negeri, terhadap",0
Analisis Faktor-Faktor yang Memengaruhi Continuance Intention terhadap Penggunaan Aplikasi Access by KAI (Studi Kasus: Mahasiswa Fakultas Ilmu Komputer Universitas Brawijaya),"belajar, pembelajaran, mata, pelajaran, siswa, smk, malang, hasil, negeri, terhadap",0
Sistem Monitoring Target Heart Rate Pada Aktivitas Berlari Menggunakan Sinyal Electrocardiography Berbasis Shimmer,"belajar, pembelajaran, mata, pelajaran, siswa, smk, malang, hasil, negeri, terhadap",0
Sistem Monitoring Target Heart Rate pada Aktivitas Berlari menggunakan Sensor MAX30102 Berbasis ESP-32,"belajar, pembelajaran, mata, pelajaran, siswa, smk, malang, hasil, negeri, terhadap",0
