article,topic,cluster
Analisis dan Perbaikan Usability Situs Halo FILKOM menggunakan Metode Design Thinking dan System Usability Scale,"belajar, pembelajaran, mata, pelajaran, siswa, smk, malang, hasil, negeri, terhadap",0
"Analisis Kesediaan Berbagi Identitas Digital Berdasarkan PMT: Faktor Self-Efficacy, Response Efficacy, dan SNS Experience","belajar, pembelajaran, mata, pelajaran, siswa, smk, malang, hasil, negeri, terhadap",0
Analisis Peran Jenis Pekerjaan dan Fasilitas IT Pendukung terhadap Produktivitas Kerja Karyawan Work From Anywhere,"belajar, pembelajaran, mata, pelajaran, siswa, smk, malang, hasil, negeri, terhadap",0
Eksplorasi Perspektif Mahasiswa dalam Penggunaan Turnitin untuk Menghindari Plagiasi,"belajar, pembelajaran, mata, pelajaran, siswa, smk, malang, hasil, negeri, terhadap",0
Analisis Peran Pengalaman Kerja dan Linearitas Background Pendidikan terhadap Produktivitas Kerja Karyawan Work From Anywhere,"belajar, pembelajaran, mata, pelajaran, siswa, smk, malang, hasil, negeri, terhadap",0
"Pengaruh Online Streamer Personality, Visibility dan Efek Moderasi Usia Responden terhadap Trust to Streamer pada Live Shopping","belajar, pembelajaran, mata, pelajaran, siswa, smk, malang, hasil, negeri, terhadap",0
Implementasi Simple Network Management Protocol (SNMP) pada Bot Monitoring Telegram,"belajar, pembelajaran, mata, pelajaran, siswa, smk, malang, hasil, negeri, terhadap",0
Perancangan Arsitektur Sistem Informasi Pengelolaan Data Feedback di Perusahaan Pertambangan Batubara menggunakan TOGAF ADM,"belajar, pembelajaran, mata, pelajaran, siswa, smk, malang, hasil, negeri, terhadap",0
Analisis Pengaruh Gender dan Status Perkawinan terhadap Produktivitas Karyawan Work From Anywhere (WFA),"belajar, pembelajaran, mata, pelajaran, siswa, smk, malang, hasil, negeri, terhadap",0
Sistem Deteksi Tingkat Stress Menggunakan Suara dengan Metode Jaringan Saraf Tiruan dan Ekstraksi Fitur MFCC berbasis Raspberry Pi,"belajar, pembelajaran, mata, pelajaran, siswa, smk, malang, hasil, negeri, terhadap",0
Sistem Parkir Otomatis berdasarkan Pengenalan Jenis Kendaraan menggunakan Metode Yolov3-Tiny,"belajar, pembelajaran, mata, pelajaran, siswa, smk, malang, hasil, negeri, terhadap",0
Monocular Depth Estimation pada Scene dalam Ruangan menggunakan U-Net dengan ResNet,"belajar, pembelajaran, mata, pelajaran, siswa, smk, malang, hasil, negeri, terhadap",0
Pengaruh Pembelajaran Flipped Classroom terhadap Hasil Belajar Prosedural pada Konteks Mata Pelajaran Pemrograman Dasar Program Keahlian Teknik Komputer dan Jaringan di SMK Negeri 3 Malang,"belajar, pembelajaran, mata, pelajaran, siswa, smk, malang, hasil, negeri, terhadap",0
Prediksi Hasil Panen Tanaman Biofarmaka di Indonesia dengan Menggunakan Metode Extreme Learning Machine,"belajar, pembelajaran, mata, pelajaran, siswa, smk, malang, hasil, negeri, terhadap",0
Perancangan Sistem Deteksi Koefisien Kopling Magnetik pada Wireless Power Transfer menggunakan Perbandingan Respon Frekuensi dengan Metrik Euclidean Distance,"belajar, pembelajaran, mata, pelajaran, siswa, smk, malang, hasil, negeri, terhadap",0
"Analisis Kesediaan Berbagi Identitas Digital berdasarkan Faktor Self-Efficacy, Perceived Severity dan Gender","belajar, pembelajaran, mata, pelajaran, siswa, smk, malang, hasil, negeri, terhadap",0
Klasifikasi Kelayakan Calon Kreditur menggunakan Metode Syntethic Minority Over-Sampling Technique (SMOTE) dan K-Nearest Neighbor (KNN),"belajar, pembelajaran, mata, pelajaran, siswa, smk, malang, hasil, negeri, terhadap",0
Perancangan dan Implementasi Server Presensi Online dengan Geotagging berbasis Foto,"belajar, pembelajaran, mata, pelajaran, siswa, smk, malang, hasil, negeri, terhadap",0
Navigasi Halang Rintang Quadcopter Tanpa Awak menggunakan RPLIDAR dan Algoritma Bug2 berbasis Raspberry Pi,"belajar, pembelajaran, mata, pelajaran, siswa, smk, malang, hasil, negeri, terhadap",0
Analisis Kualitas Website MAN 2 Kota Serang menggunakan Metode Webqual 4.0 dan Importance Performance Analysis (IPA),"belajar, pembelajaran, mata, pelajaran, siswa, smk, malang, hasil, negeri, terhadap",0
Analisis Penggunaan Software Turnitin sebagai Alat Pendeteksi Plagiarisme,"belajar, pembelajaran, mata, pelajaran, siswa, smk, malang, hasil, negeri, terhadap",0
Implementasi Platform Visualisasi dan Analisis Trafik Jaringan menggunakan Arkime pada Jaringan Small-Office/Home-Office,"belajar, pembelajaran, mata, pelajaran, siswa, smk, malang, hasil, negeri, terhadap",0
Sistem Guided Following Control pada Smart Wheelchair menggunakan Metode Yolov5 berbasis Nvidia Jetson TX2,"belajar, pembelajaran, mata, pelajaran, siswa, smk, malang, hasil, negeri, terhadap",0
Pengembangan Sistem Navigasi Robot Beroda menggunakan Lokalisasi berbasis RFID dengan Pathfinding Algoritma A Star pada Simulasi Lingkungan Gudang,"belajar, pembelajaran, mata, pelajaran, siswa, smk, malang, hasil, negeri, terhadap",0
Perancangan Sistem Deteksi Koefisien Koupling Magnetik pada Wireless Power Transfer menggunakan Perbandingan Respon Frekuensi dengan Metrik Manhattan Distance,"belajar, pembelajaran, mata, pelajaran, siswa, smk, malang, hasil, negeri, terhadap",0
Pengaruh Rekayasa Tingkat Energi Routing Protocol Dynamic Source Routing (DSR) pada Mobile Ad Hoc Network (MANET),"belajar, pembelajaran, mata, pelajaran, siswa, smk, malang, hasil, negeri, terhadap",0
Rancang Bangun Sistem Deteksi Hipoksia berdasarkan Detak Jantung dan Saturasi Oksigen menggunakan Low Power Mode dengan Metode Naive Bayes,"belajar, pembelajaran, mata, pelajaran, siswa, smk, malang, hasil, negeri, terhadap",0
Perancangan dan Implementasi Programmable Function Generator menggunakan H-Bridge L298N untuk Rangkaian Wireless Power Transfer,"belajar, pembelajaran, mata, pelajaran, siswa, smk, malang, hasil, negeri, terhadap",0
Sistem Voice Command pada Kursi Roda Pintar menggunakan MFCC dan CNN berbasis Jetson TX2,"belajar, pembelajaran, mata, pelajaran, siswa, smk, malang, hasil, negeri, terhadap",0
Rancang Bangun Programmable Frequency Generator untuk Wireless Power Transfer berbasis H-bridge MOSFET IRF3205,"belajar, pembelajaran, mata, pelajaran, siswa, smk, malang, hasil, negeri, terhadap",0
Sistem Prediksi Sisa Waktu Nyala Baterai Uninterruptible Power Supply Lampu Kandang Ayam menggunakan Regresi Linier,"belajar, pembelajaran, mata, pelajaran, siswa, smk, malang, hasil, negeri, terhadap",0
Eksplorasi Pengaruh Teknologi Live Shopping terhadap Minat Beli Pelanggan dengan Systematic Literature Review,"belajar, pembelajaran, mata, pelajaran, siswa, smk, malang, hasil, negeri, terhadap",0
"Analisis Kesediaan Berbagi Identitas Digital berdasarkan PMT: Perceived Severity, Perceived Vulnerability, Response Efficacy, dan Usia","belajar, pembelajaran, mata, pelajaran, siswa, smk, malang, hasil, negeri, terhadap",0
"Klasifikasi Kelayakan Susu Sapi UHT berdasarkan PH, Warna, dan Aroma menggunakan Metode Naive Bayes berbasis Arduino","belajar, pembelajaran, mata, pelajaran, siswa, smk, malang, hasil, negeri, terhadap",0
Sistem Pengenalan Intensitas Emosi Sedih melalui Ucapan menggunakan Ekstraksi Bark-Frequency Cepstral Coefficient dan K-Nearest Neighbor berbasis Raspberry Pi 4,"belajar, pembelajaran, mata, pelajaran, siswa, smk, malang, hasil, negeri, terhadap",0
Sistem Pengenalan Intensitas Emosi Marah melalui Ucapan menggunakan Ekstraksi Wavelet-Based Frequency Cepstral Coefficients dan Algoritma K-Nearest Neighbor berbasis Raspberry Pi 4,"belajar, pembelajaran, mata, pelajaran, siswa, smk, malang, hasil, negeri, terhadap",0
Analisis Kualitas Website XYZ.com menggunakan Model ISO/IEC 25010 Product Quality,"belajar, pembelajaran, mata, pelajaran, siswa, smk, malang, hasil, negeri, terhadap",0
Perancangan dan Implementasi Sistem Pemantauan Kotak Benih terhadap Ruangan menggunakan Protokol ESP-NOW,"belajar, pembelajaran, mata, pelajaran, siswa, smk, malang, hasil, negeri, terhadap",0
Sistem Pendeteksian Node Baru Otomatis pada WSN Topologi Mesh berbasis ESP-NOW,"belajar, pembelajaran, mata, pelajaran, siswa, smk, malang, hasil, negeri, terhadap",0
Analisis Perbandingan Performa Algoritma Pendeteksi Puncak R pada Realtime Akuisisi Sinyal Electrocardiography berbasis Shimmer,"belajar, pembelajaran, mata, pelajaran, siswa, smk, malang, hasil, negeri, terhadap",0
Sinkronisasi Waktu pada WSN Topologi Bintang berbasis ESP-Now menggunakan LTS,"belajar, pembelajaran, mata, pelajaran, siswa, smk, malang, hasil, negeri, terhadap",0
Sistem Pemeriksa Kelayakan Pelumas pada Mesin berdasarkan Kekentalan dan Kekeruhan menggunakan Metode Naïve Bayes,"belajar, pembelajaran, mata, pelajaran, siswa, smk, malang, hasil, negeri, terhadap",0
Analisis Karakteristik Transmisi LORA dalam Ruangan,"belajar, pembelajaran, mata, pelajaran, siswa, smk, malang, hasil, negeri, terhadap",0
Implementasi Regresi Linear terhadap Optimalisasi Food Dosage Estimation pada Pemberi Pakan Kucing,"belajar, pembelajaran, mata, pelajaran, siswa, smk, malang, hasil, negeri, terhadap",0
Pengembangan Media Pembelajaran e-Modul Interaktif untuk Meningkatkan Hasil Belajar Siswa pada Mata Pelajaran Dasar Program Keahlian Jurusan Desain Komunikasi Visual (DKV) di SMK Negeri 5 Malang,"belajar, pembelajaran, mata, pelajaran, siswa, smk, malang, hasil, negeri, terhadap",0
Identifikasi Penyakit Tanaman Cabai menggunakan Metode Learning Vector Quantization (LVQ),"belajar, pembelajaran, mata, pelajaran, siswa, smk, malang, hasil, negeri, terhadap",0
Evaluasi Usability Aplikasi Pengklasifikasian Biji Kopi dan Prediksi Harga Kopi “Discoffery” menggunakan Metode Usability Testing,"belajar, pembelajaran, mata, pelajaran, siswa, smk, malang, hasil, negeri, terhadap",0
Pengaruh Implementasi Model Pembelajaran Project Based Learning terhadap Hasil Belajar Siswa pada Mata Pelajaran Komputer dan Jaringan Dasar di SMK Negeri 6 Malang,"belajar, pembelajaran, mata, pelajaran, siswa, smk, malang, hasil, negeri, terhadap",0
Pengaruh Atribut Key Opinion Leader (KOL) pada Media Sosial Instagram terhadap Minat Beli Konsumen pada Bootcamp Online,"belajar, pembelajaran, mata, pelajaran, siswa, smk, malang, hasil, negeri, terhadap",0
Pengaruh Utilitarian Value dan Emotional Value terhadap Impulsive Buying melalui Kepercayaan Konsumen pada e-Commerce di Indonesia,"belajar, pembelajaran, mata, pelajaran, siswa, smk, malang, hasil, negeri, terhadap",0
Pengaruh Bootcamp Online terhadap Kesiapan Kerja Mahasiswa,"belajar, pembelajaran, mata, pelajaran, siswa, smk, malang, hasil, negeri, terhadap",0
Perancangan Pengalaman Pengguna Aplikasi Perangkat Bergerak Pencarian Informasi Praktik Mandiri Dokter Spesialis di Kota Mataram,"belajar, pembelajaran, mata, pelajaran, siswa, smk, malang, hasil, negeri, terhadap",0
Pengembangan e-Modul Pembelajaran “Informatika” menggunakan Metode Research and Development (R&D),"belajar, pembelajaran, mata, pelajaran, siswa, smk, malang, hasil, negeri, terhadap",0
Hubungan Minat Belajar dan Motivasi Belajar Siswa terhadap Perencanaan Karier Siswa Jurusan Teknik Komputer dan Jaringan di SMK Negeri 3 Malang,"belajar, pembelajaran, mata, pelajaran, siswa, smk, malang, hasil, negeri, terhadap",0
Pengaruh Information Overload pada LinkedIn terhadap Perilaku Penghentian Penggunaan,"belajar, pembelajaran, mata, pelajaran, siswa, smk, malang, hasil, negeri, terhadap",0
Sistem Monitoring Postur Duduk pada Pemain Game Online menggunakan Sensor Load Cell dan Ultrasonik dengan Metode K-Nearest Neighbor (KNN) berbasis Arduino,"belajar, pembelajaran, mata, pelajaran, siswa, smk, malang, hasil, negeri, terhadap",0
Evaluasi Pengalaman Pengguna pada LMS E-Learning UIN Malang menggunakan Metode UX Curve dari Sudut Pandang Pengajar (Studi Kasus: Dosen Jurusan Psikologi Universitas Islam Negeri Maulana Malik Ibrahim Malang),"belajar, pembelajaran, mata, pelajaran, siswa, smk, malang, hasil, negeri, terhadap",0
Analisis Sentimen Ulasan Pengguna Aplikasi Info BMKG pada Google Play Store di Indonesia,"belajar, pembelajaran, mata, pelajaran, siswa, smk, malang, hasil, negeri, terhadap",0
Implementasi Deep Learning menggunakan Algoritma EfficientDet untuk Sistem Deteksi Kelayakan Penerima Bantuan Langsung Tunai berdasarkan Citra Rumah di Wilayah Kabupaten Kediri,"belajar, pembelajaran, mata, pelajaran, siswa, smk, malang, hasil, negeri, terhadap",0
"Sistem Penyiraman Tanaman Bawang Merah berdasarkan Kondisi Suhu Udara, Kelembapan Tanah, dan PH Tanah dengan Metode Logika Fuzzy","belajar, pembelajaran, mata, pelajaran, siswa, smk, malang, hasil, negeri, terhadap",0
Klasifikasi Kesuburan dan Daya Ukur Cakupan Kelembaban Tanah pada Tanaman Jambu Merah berbasis Arduino,"belajar, pembelajaran, mata, pelajaran, siswa, smk, malang, hasil, negeri, terhadap",0
Sistem Monitoring Gerakan Sit-up berbasis Data Sensor Accelerometer dan Gyroscope menggunakan Algoritma K-Nearest Neighbor pada NodeMCU ESP8266,"belajar, pembelajaran, mata, pelajaran, siswa, smk, malang, hasil, negeri, terhadap",0
Analisis Learning Journey Map pada Antarmuka Platform Code Maniac dengan Metode Design Thinking (Studi pada SMKN 6 Malang),"belajar, pembelajaran, mata, pelajaran, siswa, smk, malang, hasil, negeri, terhadap",0
Implementasi Real-Time OS pada Sistem Perangkat Wearable “Clever-Mask” untuk Pemantauan Pola Pernapasan sebagai Penanganan Pertama pada Pasien Terdampak Covid-19 secara Kontinyu,"belajar, pembelajaran, mata, pelajaran, siswa, smk, malang, hasil, negeri, terhadap",0
Pengembangan Pengiriman Data Purwarupa Sistem Kontrol dan Monitoring Kanal Air menggunakan Webserver,"belajar, pembelajaran, mata, pelajaran, siswa, smk, malang, hasil, negeri, terhadap",0
Optimasi Gizi pada Lanjut Usia dengan Alergi untuk Meningkatkan Kualitas Hidup menggunakan Algoritma Genetika,"belajar, pembelajaran, mata, pelajaran, siswa, smk, malang, hasil, negeri, terhadap",0
Pengembangan Modul Digital Interaktif berdasarkan Sintaks Pengajaran Competency Based Training (CBT) untuk Mata Pelajaran Jaringan Komputer dan Internet (JKI) di SMK Negeri 11 Malang,"belajar, pembelajaran, mata, pelajaran, siswa, smk, malang, hasil, negeri, terhadap",0
Implementasi Sistem Monitoring Sungai berbasis LoRa-MQTT Gateway,"belajar, pembelajaran, mata, pelajaran, siswa, smk, malang, hasil, negeri, terhadap",0
Pengembangan E-Modul Interaktif menggunakan Model ADDIE pada Mata Pelajaran Dasar-Dasar Teknik Jaringan Komputer dan Telekomunikasi (Studi pada: Kelas X Jurusan TKJ SMKN 3 Malang),"belajar, pembelajaran, mata, pelajaran, siswa, smk, malang, hasil, negeri, terhadap",0
Analisis Perbandingan Dampak Serangan Distributed Denial of Service pada Protokol Routing OSPF dan IS-IS,"belajar, pembelajaran, mata, pelajaran, siswa, smk, malang, hasil, negeri, terhadap",0
Pengaruh Implementasi Unsur Desain Grafis pada Media Pembelajaran berbasis Presentasi dalam Mata Pelajaran Pemrograman Dasar terhadap Motivasi Belajar Siswa SMK,"belajar, pembelajaran, mata, pelajaran, siswa, smk, malang, hasil, negeri, terhadap",0
Penentuan Mutu pada Citra Buah Jeruk Keprok menggunakan Metode Local Binary Pattern (LBP),"belajar, pembelajaran, mata, pelajaran, siswa, smk, malang, hasil, negeri, terhadap",0
Optimasi Rute Wisata Religi di Jawa Timur menggunakan Algoritme Genetika,"belajar, pembelajaran, mata, pelajaran, siswa, smk, malang, hasil, negeri, terhadap",0
Pengembangan Sistem Klasifikasi Rasa Buah Jeruk Peras Jenis Baby Java menggunakan Diameter Buah dan Nilai Sensor Tegangan berbasis Arduino Uno dengan Metode Naïve Bayes,"belajar, pembelajaran, mata, pelajaran, siswa, smk, malang, hasil, negeri, terhadap",0
Sistem Pendeteksi Atrial Fibrilasi berdasarkan Fitur Mean dan Median dari Interval QT menggunakan Metode Naïve Bayes,"belajar, pembelajaran, mata, pelajaran, siswa, smk, malang, hasil, negeri, terhadap",0
Implementasi Bluetooth Low Energy dan Telegram pada Sistem Monitoring dan Control Kunci Pintu Rumah menggunakan Routing Multihop,"belajar, pembelajaran, mata, pelajaran, siswa, smk, malang, hasil, negeri, terhadap",0
Analisis Proses Bisnis CV Dinasty menggunakan Root Cause Analysis dan Pendekatan Lean,"belajar, pembelajaran, mata, pelajaran, siswa, smk, malang, hasil, negeri, terhadap",0
Perancangan Aplikasi WBA-Nizer sebagai Pengelolaan Kegiatan Wardah Beauty Agent,"belajar, pembelajaran, mata, pelajaran, siswa, smk, malang, hasil, negeri, terhadap",0
Implementasi Kombinasi Eksponensial dan Notch Filter Untuk Mengurangi Noise Pada Sistem Pengenalan Pergerakan Lengan Prostetik Bionik,"belajar, pembelajaran, mata, pelajaran, siswa, smk, malang, hasil, negeri, terhadap",0
Deteksi Nefropati Diabetik Pada Pasien Diabetes Melitus Menggunakan Regresi Logistik,"belajar, pembelajaran, mata, pelajaran, siswa, smk, malang, hasil, negeri, terhadap",0
"Klasifikasi Kelayakan Konsumsi Susu Kambing Etawa Pasteurisasi Berdasarkan Warna, Aroma, dan PH dengan Metode Random Forest Berbasis Arduino","belajar, pembelajaran, mata, pelajaran, siswa, smk, malang, hasil, negeri, terhadap",0
Sistem Kendali Pengikut Terarah Smart Wheelchair pada Pencahayaan Beragam Menggunakan Gamma Correction dan YOLOv8n Termodifikasi,"belajar, pembelajaran, mata, pelajaran, siswa, smk, malang, hasil, negeri, terhadap",0
Deteksi Bencana Banjir Berdasarkan Data Curah Hujan Di Daerah Jakarta Menggunakan Logistic Regression Neural Network,"belajar, pembelajaran, mata, pelajaran, siswa, smk, malang, hasil, negeri, terhadap",0
Evaluasi Usability Aplikasi PERSADA: Sistem Monitoring Pajak Daerah di Kota Malang,"belajar, pembelajaran, mata, pelajaran, siswa, smk, malang, hasil, negeri, terhadap",0
Analisis Performa Arduino Uno Dalam Embedded System Berbasis RFID Terhadap Algoritma Enkripsi SKINNY,"belajar, pembelajaran, mata, pelajaran, siswa, smk, malang, hasil, negeri, terhadap",0
Evaluasi Kesuksesan Layanan Website Eduakksa Berdasarkan Teori DeLone and McLean Model,"belajar, pembelajaran, mata, pelajaran, siswa, smk, malang, hasil, negeri, terhadap",0
Analisis Quality in Use dan SWOT Produk Skincare Lokal dan Global Berdasarkan Sentimen Pengguna,"belajar, pembelajaran, mata, pelajaran, siswa, smk, malang, hasil, negeri, terhadap",0
Pengaruh Keterampilan Mengelola Kelas dan Kompetensi Pedagogik Mahasiswa PLP Program Studi Pendidikan Teknologi Informasi Universitas Brawijaya Terhadap Motivasi Belajar Siswa di SMK Negeri 4 Malang,"belajar, pembelajaran, mata, pelajaran, siswa, smk, malang, hasil, negeri, terhadap",0
Klasifikasi Kelayakan Konsumsi Air Kelapa Berdasarkan PH dan Kekeruhan Menggunakan Metode Random Forest Berbasis Arduino,"belajar, pembelajaran, mata, pelajaran, siswa, smk, malang, hasil, negeri, terhadap",0
Analisis Sentimen Ulasan Konsumen Martabak Kubang Hayuda Menggunakan Support Vector Machine,"belajar, pembelajaran, mata, pelajaran, siswa, smk, malang, hasil, negeri, terhadap",0
Perancangan Pengalaman Pengguna E-Learning Pendamping Pelatihan Cybersecurity,"belajar, pembelajaran, mata, pelajaran, siswa, smk, malang, hasil, negeri, terhadap",0
Penerapan Modul Ghost dan SimAM pada Sistem Guide Following Kursi Roda Pintar Berbasis YOLOv8N,"belajar, pembelajaran, mata, pelajaran, siswa, smk, malang, hasil, negeri, terhadap",0
"Analisis Pengaruh Diskon Harga, Ulasan Produk, Dan Persepsi Kualitas Terhadap Minat Beli Pengguna Flashsale TikTokShop","belajar, pembelajaran, mata, pelajaran, siswa, smk, malang, hasil, negeri, terhadap",0
Analisis Akar Permasalahan  Kepuasan Tamu Hotel Savana Berdasarkan Sentimen Negatif,"belajar, pembelajaran, mata, pelajaran, siswa, smk, malang, hasil, negeri, terhadap",0
Pengaruh Penggunaan Wordwall dalam Meningkatkan Hasil Belajar Siswa SMK Negeri 12 Malang Pada Mata Pelajaran Informatika,"belajar, pembelajaran, mata, pelajaran, siswa, smk, malang, hasil, negeri, terhadap",0
Deteksi Pergerakan Kepala Menggunakan Kombinasi YOLOv8N dan GhostNet untuk Navigasi Kursi Roda Pintar,"belajar, pembelajaran, mata, pelajaran, siswa, smk, malang, hasil, negeri, terhadap",0
Analisa Perbandingan Performa Framework Web Server Nest JS Dan Hapi JS Berbasis REST API,"belajar, pembelajaran, mata, pelajaran, siswa, smk, malang, hasil, negeri, terhadap",0
Perbandingan Model Machine Learning untuk Prediksi Bencana Tanah Longsor Secara Spasial di Kabupaten Malang,"belajar, pembelajaran, mata, pelajaran, siswa, smk, malang, hasil, negeri, terhadap",0
Penerapan Machine Learning Extreme Gradient Boosting Dalam Klasifikasi Potensi Tsunami Berdasarkan Data Gempa Bumi,"belajar, pembelajaran, mata, pelajaran, siswa, smk, malang, hasil, negeri, terhadap",0
Pengaruh Implementasi Problem-Based Learning Berbantuan Sumber  Belajar Digital pada Mata Pelajaran Instalasi Perangkat Jaringan,"belajar, pembelajaran, mata, pelajaran, siswa, smk, malang, hasil, negeri, terhadap",0
Analisis Geospasial Perubahan Penggunaan Lahan Sawah Di Kota Malang Menggunakan Google Earth Engine,"belajar, pembelajaran, mata, pelajaran, siswa, smk, malang, hasil, negeri, terhadap",0
Penerapan Ekstraksi BFCC Pada Hidden Markov Model Untuk Identifikasi Emosi Manusia Berdasarkan Suara Detak Jantung,"belajar, pembelajaran, mata, pelajaran, siswa, smk, malang, hasil, negeri, terhadap",0
Analisis Teknik Embedding Model NV-Embed pada Large Language Models Berbasis Retrieval Augmented Generation,"belajar, pembelajaran, mata, pelajaran, siswa, smk, malang, hasil, negeri, terhadap",0
Pengembangan Business Intelligence Dashboard Untuk Monitoring Key Performance Indicator Perusahaan di WWMusik Malang,"belajar, pembelajaran, mata, pelajaran, siswa, smk, malang, hasil, negeri, terhadap",0
Analisis Sentimen Produk Hijab Pada E-Commerce Tokopedia Menggunakan Algoritma Support Vector Machine dan IndoBERT Embedding,"belajar, pembelajaran, mata, pelajaran, siswa, smk, malang, hasil, negeri, terhadap",0
Evaluasi Penerimaan Layanan Aplikasi LolosASN Berdasarkan Teori Technology Acceptance Model,"belajar, pembelajaran, mata, pelajaran, siswa, smk, malang, hasil, negeri, terhadap",0
"Klasifikasi Kelayakan Konsumsi Susu Kedelai Berdasarkan PH, Warna, dan Aroma Menggunakan Metode Random Forest Berbasis Arduino","belajar, pembelajaran, mata, pelajaran, siswa, smk, malang, hasil, negeri, terhadap",0
Implementasi Convolutional Neural Network Pada Lengan Prostetik Bionik Berbasis Wearable Electromyography Armband Sensor,"belajar, pembelajaran, mata, pelajaran, siswa, smk, malang, hasil, negeri, terhadap",0
Implementasi Sistem Inferensi Klasifikasi Detak Jantung Berbasis Stream Processing Pada Jetson Nano,"belajar, pembelajaran, mata, pelajaran, siswa, smk, malang, hasil, negeri, terhadap",0
Penerapan Algoritma K-Means Clustering untuk Segmentasi Pelanggan Berdasarkan Model RFM Pada Resik Aquatics,"belajar, pembelajaran, mata, pelajaran, siswa, smk, malang, hasil, negeri, terhadap",0
Deteksi Arah Pergerakan Kepala untuk Navigasi pada Kursi Roda Pintar Menggunakan Kombinasi Metode Berbasis YOLOv8N,"belajar, pembelajaran, mata, pelajaran, siswa, smk, malang, hasil, negeri, terhadap",0
Sistem Wearable untuk Training Aerodinamis Pesepeda pada Posisi Drop Bar dengan Metode Random Forest Berbasis Data MPU6050,"belajar, pembelajaran, mata, pelajaran, siswa, smk, malang, hasil, negeri, terhadap",0
Pengembangan Sistem Smart Home Berbasis Pengenalan Suara Menggunakan Model Long Short-Term Memory,"belajar, pembelajaran, mata, pelajaran, siswa, smk, malang, hasil, negeri, terhadap",0
Analisis Klasifikasi Spam Email Menggunakan Metode Extreme Gradient Boosting (XGBoost),"belajar, pembelajaran, mata, pelajaran, siswa, smk, malang, hasil, negeri, terhadap",0
Analisis Performa Arduino Uno Dalam Penggunaan  Algoritma Enkripsi Speck-128 Dalam Implementasi Sistem RFID,"belajar, pembelajaran, mata, pelajaran, siswa, smk, malang, hasil, negeri, terhadap",0
Analisis Sentimen Berbasis Aspek Ulasan Pengguna Aplikasi Alfagift Menggunakan Metode Random Forest dan Pemodelan Topik Latent Dirichlet Allocation,"belajar, pembelajaran, mata, pelajaran, siswa, smk, malang, hasil, negeri, terhadap",0
Pengaruh Koefisien Kopling dan Jarak Pada Pengembangan Sistem Penghantar Daya Nirkabel,"belajar, pembelajaran, mata, pelajaran, siswa, smk, malang, hasil, negeri, terhadap",0
Pengaruh Penerapan Model Pembelajaran Teams Games Tournament Terhadap Hasil Belajar Peserta Didik Mata Pelajaran Informatika Di SMK 1 Pancasila Ambulu,"belajar, pembelajaran, mata, pelajaran, siswa, smk, malang, hasil, negeri, terhadap",0
Pengembangan Dashboard Business Intelligence dengan Integrasi Metode Kimball Lifecycle dan Design Thinking untuk Memantau Performa Karyawan di PT Jalin Mayantara Indonesia,"belajar, pembelajaran, mata, pelajaran, siswa, smk, malang, hasil, negeri, terhadap",0
Analisis Pengaruh Penggunaan Strategi Semantic Search Engine Optimization (SEO) dan Keyword Mapping Terhadap Visibilitas Website Merteyasabaliadventure.com pada Search Engine,"belajar, pembelajaran, mata, pelajaran, siswa, smk, malang, hasil, negeri, terhadap",0
Implementasi Sistem Deteksi Anomali pada Jaringan Komputer dengan Pendekatan XGBoost dan Data SNMP,"belajar, pembelajaran, mata, pelajaran, siswa, smk, malang, hasil, negeri, terhadap",0
Analisis dan Evaluasi Proses Bisnis Pada Manajemen Sumber Daya Manusia Dalam Meningkatkan Kinerja Operasional Di PT Telkom Indonesia,"belajar, pembelajaran, mata, pelajaran, siswa, smk, malang, hasil, negeri, terhadap",0
Analisis Perbandingan Sentimen Pengguna X dan Reddit Terhadap Starlink di Indonesia Melalui Uji Hipotesis Statistik Two-Proportion Z-Test,"belajar, pembelajaran, mata, pelajaran, siswa, smk, malang, hasil, negeri, terhadap",0
Implementasi Sarung Tangan Gaming Boxing : “Thunder Ray” Dengan Menggunakan Sensor Gerak MPU6050 Dan Metode Random Forest Untuk Pendeteksi Gerakan Tinju,"belajar, pembelajaran, mata, pelajaran, siswa, smk, malang, hasil, negeri, terhadap",0
Penggunaan Model Tabular Retrieval Model (TabR) dengan K-Means Clustering untuk Efisiensi Klasifikasi dan Regresi Data Tabular,"belajar, pembelajaran, mata, pelajaran, siswa, smk, malang, hasil, negeri, terhadap",0
